{
  "$schema": "https://json-schema.org/draft/2020-12/schema",
  "title": "Claude Code plugin.json, as documented at code.claude.com/docs/en/plugins/manifest-reference",
  "type": "object",
  "required": ["name"],
  "additionalProperties": false,
  "properties": {
    "$schema": {"type": "string"},
    "name": {"type": "string", "pattern": "^[a-z0-9]+(-[a-z0-9]+)*$"},
    "displayName": {"type": "string", "minLength": 1},
    "version": {"type": "string", "minLength": 1},
    "description": {"type": "string", "minLength": 1},
    "author": {
      "type": "object",
      "required": ["name"],
      "additionalProperties": false,
      "properties": {
        "name": {"type": "string"},
        "email": {"type": "string"},
        "url": {"type": "string"}
      }
    },
    "homepage": {"type": "string", "format": "uri"},
    "repository": {"type": "string"},
    "license": {"type": "string"},
    "keywords": {"type": "array", "items": {"type": "string"}},
    "defaultEnabled": {"type": "boolean"},
    "dependencies": {"type": "array"},
    "skills": {},
    "commands": {},
    "agents": {},
    "hooks": {},
    "mcpServers": {},
    "lspServers": {},
    "outputStyles": {},
    "userConfig": {"type": "object"}
  }
}
